{
  "household": {
    "name": "Demo household",
    "timezone": "America/Los_Angeles"
  },
  "objects": [
    {
      "object_id": "salt",
      "name": "salt",
      "aliases": [
        "table salt",
        "sea salt"
      ],
      "notes": "For cooking and for eggs.",
      "description": "Small glass jar with a white lid, identical to the sugar jar.",
      "tag": "04A1B2C3D4E501",
      "home_spot": 2,
      "is_medication": false,
      "fob_id": null
    },
    {
      "object_id": "sugar",
      "name": "sugar",
      "aliases": [
        "white sugar",
        "sweetener"
      ],
      "notes": "For coffee and tea.",
      "description": "Small glass jar with a white lid, identical to the salt jar.",
      "tag": "04A1B2C3D4E502",
      "home_spot": 3,
      "is_medication": false,
      "fob_id": null
    },
    {
      "object_id": "pepper",
      "name": "pepper",
      "aliases": [
        "black pepper",
        "pepper grinder"
      ],
      "notes": "For eggs and soup. Usually kept in the pantry.",
      "description": "Tall wooden pepper grinder.",
      "tag": "04A1B2C3D4E503",
      "home_spot": null,
      "is_medication": false,
      "fob_id": null
    },
    {
      "object_id": "bp_meds",
      "name": "blood pressure pills",
      "aliases": [
        "pills",
        "medication",
        "medicine",
        "blood pressure medicine",
        "morning pills",
        "evening pills"
      ],
      "notes": "Taken at 8 in the morning and 8 in the evening.",
      "description": "White plastic pill bottle with a child-proof cap.",
      "tag": "04A1B2C3D4E504",
      "home_spot": 4,
      "is_medication": true,
      "fob_id": null
    },
    {
      "object_id": "keys",
      "name": "keys",
      "aliases": [
        "house keys",
        "car keys",
        "key ring"
      ],
      "notes": "Roams; carries a Bluetooth fob.",
      "description": "Key ring with a small Bluetooth tracker fob.",
      "tag": null,
      "home_spot": null,
      "is_medication": false,
      "fob_id": "fob_keys"
    }
  ],
  "medications": [
    {
      "object_id": "bp_meds",
      "schedule_times": [
        "08:00",
        "20:00"
      ],
      "window_minutes": 60
    }
  ],
  "version": 1761350400000
}
